{
  "schema": 1,
  "name": "Котельная",
  "node": "boiler",
  "role": "boiler",
  "state": "active",
  "capabilities": [
    "hhm",
    "pressure_makeup"
  ],
  "components": {
    "hhm": {
      "track": "stable"
    },
    "pressure_makeup": {
      "track": "stable"
    }
  },
  "object_files": [
    {
      "source": "Objects/05_31_Ivolga_13/Wirenboard/wb-rules-modules/system.js",
      "target": "/etc/wb-rules-modules/system.js"
    },
    {
      "source": "Objects/05_31_Ivolga_13/Wirenboard/wb-rules/090_notification_service.js",
      "target": "/etc/wb-rules/090_notification_service.js"
    },
    {
      "source": "Objects/05_31_Ivolga_13/Wirenboard/wb-rules/100_power_monitor.js",
      "target": "/etc/wb-rules/100_power_monitor.js"
    },
    {
      "source": "Objects/05_31_Ivolga_13/Wirenboard/wb-rules/610_Boiler_state.js",
      "target": "/etc/wb-rules/610_Boiler_state.js"
    }
  ],
  "diagnostics_profile": "Systems/NST/diagnostics/ivolga-boiler-hhm-v2.json"
}
