{
  "schema": 1,
  "name": "Исеть — контроллер дома",
  "node": "house",
  "role": "house",
  "state": "active",
  "capabilities": [
    "hhm"
  ],
  "components": {
    "hhm": {
      "track": "stable"
    }
  },
  "object_files": [],
  "unmanaged_rules": {
    "/etc/wb-rules-modules/WBHelpers.js": "98866e1000910e6966698d1177c7007981d03e572bd2e1cf732ae299d6ac70ec",
    "/etc/wb-rules/AHU_preheat_pump_manager.js": "ff0e70edb486a84aff48c5f3c0b2c40db417b4a88224c14f0a07b0851dbd59d3",
    "/etc/wb-rules/DHW_recirculation_manager.js": "79f03ca754ffabd41417c7dfdf7c7817fb3b3bace7d06abc77fdcd9d35037863",
    "/etc/wb-rules/Email_service.js": "eedd07cc45d95786310b7d355a4a6d965ec57a85bdfb46ba6bf868e813b9e64e",
    "/etc/wb-rules/House_mode_manager.js": "e3e021d685488c9581cd62fedb2084de6679d8ae084e496a77a56d514a97f533",
    "/etc/wb-rules/Light_4.js": "a4e0276ef4a373e3767018a3e0a15de0079ff6d3ed4ee04dac5e513097663410",
    "/etc/wb-rules/Master-Light.js": "448f3c111785fb3462e6a285318317ae38b0dc00e2e857f34b5e16bda40fc268",
    "/etc/wb-rules/rules.js": "146c0fcdd728cef04eff74d72fbbfdd27ebab05a15e9e09951b517e24d96a0c0",
    "/etc/wb-rules/Vilpe_control_v3.js": "d54f505855d4f948b6033d652cf67280869f0dbe656f4a04a209f55c78ce967c"
  },
  "diagnostics_profile": "Systems/NST/diagnostics/iset-house-hhm-v1.json",
  "fingerprint_sha256": "a83346c0b7b329aa776e516ac40f298e37409cc9b6b51a33558502369b42d158"
}
